{
  "schemaVersion": 1,
  "issuer": "promptiris.host",
  "verifierId": "promptiris.role-verifier",
  "nativeProofRef": ".scratch/harness-integrity/issues/05-independent-roles.evidence/role-protocol/attempt-c87af1a4-06ce-4572-b787-52c330b87c12/native-proof.json",
  "nativeProofDigest": "sha256:f55c53a4361be5cc1347690d039213e25d91f4cbd57e40fc73471194f8a242b1",
  "subject": "luna-harden-final7",
  "producerId": "luna-harden-final7",
  "attemptId": "attempt-c87af1a4-06ce-4572-b787-52c330b87c12",
  "parentInvocationId": "promptiris-final7-20260915",
  "role": "hardener",
  "candidateRevision": "sha256:577db3fc7f79186fcc2a41efc4ebeef653870ba0d2f1b81c8a0f5ca1b7b7505a",
  "promptDigest": "sha256:cfdc50a75dd9463f10906d4d676ed1bef51f5f5ae78a73777146a000ba28fa42",
  "inputManifestDigest": "sha256:a767eee0b041efde550c86215d50b7fad289c6a141ff9c32fe6b24b2ae916df5",
  "sourceAccessMode": "attack-surfaces",
  "issuedAt": "2026-09-15T06:21:47.000Z",
  "expiresAt": "2026-10-15T06:21:47.000Z",
  "nonce": "hardener-final7-c87af1a4-20260915",
  "attestationStrength": "host-attested"
}
