{"schemaVersion":1,"issuer":"promptiris.maintainer","verifierId":"promptiris.role-verifier","nativeProofRef":".scratch/harness-integrity/issues/05-independent-roles.evidence/role-protocol/attempt-196643da-d20e-4a54-9a0c-9da226b933b7/native-proof.json","nativeProofDigest":"sha256:eca7a0ac84d6c08bcf0d8962659fc350369eab167efa29c39ee4c5776cfc6e88","subject":"luna-qa-final8","producerId":"luna-qa-final8","attemptId":"attempt-196643da-d20e-4a54-9a0c-9da226b933b7","parentInvocationId":"promptiris-final8-20260915","role":"qa","candidateRevision":"sha256:408f2747861e0bcf7a8a41431381e4fb0a60d9e6e7b602e9ebee194a1bed0f7a","promptDigest":"sha256:33334901b05d3ee6f7ace889ee090c292c672be32f07ac243db0bfc8f6ab07d0","inputManifestDigest":"sha256:5e3f9def0e4046571333177c8f3cae905f30a2b31088a23d67882ed13ec8e191","sourceAccessMode":"source-blind-bundle","issuedAt":"2026-09-15T06:28:52.000Z","expiresAt":"2026-10-15T06:28:52.000Z","nonce":"qa-final8-196643da-20260915","attestationStrength":"maintainer-attested"}
