{
  "schemaVersion": 1,
  "issuer": "promptiris.host",
  "verifierId": "promptiris.role-verifier",
  "nativeProofRef": ".scratch/harness-integrity/issues/05-independent-roles.evidence/role-protocol/attempt-f8c1be14-4087-467a-b3ab-6ffbf829cb0d/native-proof.json",
  "nativeProofDigest": "sha256:fa3cbbf5ed4639210f107bdb22e700f488423e921f269061d6a26f262be297fe",
  "subject": "luna-review-final7",
  "producerId": "luna-review-final7",
  "attemptId": "attempt-f8c1be14-4087-467a-b3ab-6ffbf829cb0d",
  "parentInvocationId": "promptiris-final7-20260915",
  "role": "reviewer",
  "candidateRevision": "sha256:577db3fc7f79186fcc2a41efc4ebeef653870ba0d2f1b81c8a0f5ca1b7b7505a",
  "promptDigest": "sha256:9f9597af8d9b61ed615baabc3507833005687360640d34030b00350639c900d3",
  "inputManifestDigest": "sha256:9660347df31b9618da2ce72c77c51a3fc8eb69ff7895d9f62604e2fb16b666ce",
  "sourceAccessMode": "contract-diff",
  "issuedAt": "2026-09-15T06:21:47.000Z",
  "expiresAt": "2026-10-15T06:21:47.000Z",
  "nonce": "reviewer-final7-f8c1be14-20260915",
  "attestationStrength": "host-attested"
}
