{
  "schemaVersion": 1,
  "issuer": "promptiris.host",
  "verifierId": "promptiris.role-verifier",
  "nativeProofRef": ".scratch/harness-integrity/issues/05-independent-roles.evidence/role-protocol/attempt-22e7a333-e1ec-4b19-8427-8fb4cf6a220d/native-proof.json",
  "nativeProofDigest": "sha256:f0387203ee6fc1eeac56fff64d37c43866abc6832a6771071d5deb833aa491fc",
  "subject": "luna-reviewer-64-host",
  "producerId": "luna-reviewer-64-host",
  "attemptId": "attempt-22e7a333-e1ec-4b19-8427-8fb4cf6a220d",
  "parentInvocationId": "pr64-host-final",
  "role": "reviewer",
  "candidateRevision": "sha256:e73286c1d62e3f1efb5fd4842ed2bbd4aa16c3ccd9ccec600572cc3513d8a6e4",
  "promptDigest": "sha256:9f9597af8d9b61ed615baabc3507833005687360640d34030b00350639c900d3",
  "inputManifestDigest": "sha256:1fef45dd2a7b539e2fec93899d19dd0435567fe265df007da32cbe05bb978b10",
  "sourceAccessMode": "contract-diff",
  "issuedAt": "2026-09-10T17:18:57Z",
  "expiresAt": "2026-09-11T17:18:57Z",
  "nonce": "reviewer-host-22e7a333-final",
  "attestationStrength": "host-attested"
}
